word,meaning,example_sentences_1,meaning_example_sentences_1,example_sentences_2,meaning_example_sentences_2,image_url
助けます,giúp,私は友達を助けます。,Tôi sẽ giúp đỡ bạn của mình.,困っている人を助けることが大切です。,Giúp đỡ những người gặp khó khăn là rất quan trọng.,https://www.tanoshiijapanese.com/dictionary/entry_preview/5/33022/44604.png
優しい,hiền lành,彼女はとても優しい人です。,Cô ấy là một người rất hiền lành.,優しい言葉をかけてくれました。,Cô ấy đã nói những lời hiền lành với tôi.,https://www.ponycanyon.co.jp/images/wcms/accessor/bin/jacket/PCBC000050727.jpg?size=4&order=1
お姫様,nàng công chúc,彼女はお姫様のように美しいです。,Cô ấy đẹp như một nàng công chúa.,お姫様の物語が大好きです。,Tôi rất thích những câu chuyện về công chúa.,https://angelicpretty.com/Contents/ProductImages/0/242ST07-210477_LL.jpg
暮らします,sinh sống,私は東京で暮らしています。,Tôi đang sinh sống ở Tokyo.,彼は田舎で静かに暮らしています。,Anh ấy đang sống yên bình ở nông thôn.,https://www.tanoshiijapanese.com/dictionary/entry_preview/5/49700/63796.png
陸,đất liền,船は陸に近づいています。,Chiếc thuyền đang tiến gần đến đất liền.,陸の動物は水中の動物とは違います。,Động vật trên đất liền khác với động vật dưới nước.,https://kanji.jitenon.jp/shotai3/625.gif
すると,khi đó,彼は急に立ち上がりました。すると、みんなが驚きました。,"Anh ấy đột nhiên đứng dậy. Khi đó, mọi người đều ngạc nhiên.",雨が降り始めました。すると、彼は傘を取り出しました。,"Trời bắt đầu mưa. Khi đó, anh ấy đã lấy ô ra.",https://jlptsensei.com/wp-content/uploads/2018/02/to-sureba-%E3%81%A8%E3%81%99%E3%82%8C%E3%81%B0-jlpt-n3-grammar-meaning-%E6%96%87%E6%B3%95-%E4%BE%8B%E6%96%87-japanese-flashcards-600x338.png
煙,khói,煙が空に上がっています。,Khói đang bay lên trời.,火事の煙はとても危険です。,Khói từ hỏa hoạn rất nguy hiểm.,https://img.rednet.cn/2023/03-03/014a813e-20ce-4345-85bf-bf6eaded96cf.jpg
真っ白（な）,trắng toát,雪が真っ白に積もっています。,Tuyết đã phủ trắng xóa.,彼女のドレスは真っ白です。,Chiếc váy của cô ấy thì trắng toát.,https://heyeased.weebly.com/uploads/4/9/1/1/49114053/almost_all_white.png
中身,đồ ở bên trong,箱の中身を見てみましょう。,Hãy xem đồ bên trong hộp.,この袋の中身は何ですか？,Đồ bên trong túi này là gì?,https://live.staticflickr.com/8218/29239799835_121b015d07_b.jpg
包みます,gói,プレゼントを包みます。,Tôi sẽ gói quà.,彼はお弁当を包んで持って行きました。,Anh ấy đã gói bento và mang đi.,https://www.tanoshiijapanese.com/dictionary/entry_preview/5/56345/72683.png
沸かします,đun sôi,お湯を沸かします。,Tôi sẽ đun sôi nước.,彼女はお茶を沸かしています。,Cô ấy đang đun sôi trà.,https://www.tanoshiijapanese.com/dictionary/entry_preview/5/48394/62309.png
混ぜます,trộn,サラダを作るために、野菜を混ぜます。,"Để làm salad, tôi trộn rau củ lại với nhau.",この生地をよく混ぜてください。,Xin hãy trộn bột này thật kỹ.,https://zakka-kurawanka.com/column/cms/wp-content/uploads/2021/08/%E3%82%A4%E3%83%B3%E3%82%B9%E3%82%BF%E3%83%B3%E3%83%88%E3%83%9B%E3%82%9A%E3%83%83%E3%83%88-230-1280x854.jpg
計算します,tính toán,買い物の合計を計算します。,Tôi sẽ tính toán tổng số tiền mua sắm.,宿題の問題を計算します。,Tôi sẽ tính toán các bài tập về nhà.,https://previews.123rf.com/images/andreypopov/andreypopov1401/andreypopov140101373/25340285-%E3%83%93%E3%82%B8%E3%83%8D%E3%82%B9%E3%83%9E%E3%83%B3%E3%81%AE%E3%82%AA%E3%83%95%E3%82%A3%E3%82%B9%E3%81%A7%E9%9B%BB%E5%8D%93%E3%82%92%E4%BD%BF%E7%94%A8%E3%81%97%E3%81%A6%E3%83%89%E3%82%AD%E3%83%A5%E3%83%A1%E3%83%B3%E3%83%88%E3%82%92%E8%A8%88%E7%AE%97%E3%81%97%E3%81%BE%E3%81%99%E3%80%82.jpg
並びます,xếp hàng,バスを待つために、みんなが並びます。,Mọi người xếp hàng để chờ xe buýt.,イベントのために、長い列が並びます。,Có một hàng dài xếp hàng cho sự kiện.,https://www.tanoshiijapanese.com/dictionary/entry_preview/5/49058/63062.png
丈夫（な）,chắc chắn,このテーブルはとても丈夫です。,Cái bàn này rất chắc chắn.,丈夫な靴を買いたいです。,Tôi muốn mua một đôi giày chắc chắn.,https://as2.ftcdn.net/v2/jpg/01/26/23/57/500_F_126235701_uq3gWllAX4wRLYwURKQLlHilvXtCslvc.jpg
アパート,phòng trọ,彼は新しいアパートに引っ越しました。,Anh ấy đã chuyển đến một căn phòng trọ mới.,アパートの家賃は高いです。,Tiền thuê phòng trọ thì cao.,https://kaihatsu.uniho.co.jp/gallery/wp-content/uploads/2024/05/bd29d11a5e42312e9ba205def328c073.jpg
弁護士,luật sư,彼女は優秀な弁護士です。,Cô ấy là một luật sư xuất sắc.,弁護士に相談することが大切です。,Việc tham khảo ý kiến luật sư là rất quan trọng.,"https://m.media-amazon.com/images/I/81lRLkUzGqL._AC_UF1000,1000_QL80_.jpg"
音楽家,nhạc sĩ,彼は有名な音楽家です。,Anh ấy là một nhạc sĩ nổi tiếng.,音楽家になるのは夢です。,Trở thành nhạc sĩ là ước mơ của tôi.,https://jweeklyusa.com/wp-content/uploads/2022/04/sanjosepiano_1914_webimg1.png
子供たち,những đứa trẻ,子供たちは公園で遊んでいます。,Những đứa trẻ đang chơi ở công viên.,子供たちに本を読んであげます。,Tôi sẽ đọc sách cho những đứa trẻ.,https://www.ecostylepower.com/ecolopii/wp-content/uploads/2018/05/170805_main.jpg
自然,tự nhiên,自然を大切にしましょう。,Hãy trân trọng thiên nhiên.,山の自然は美しいです。,Thiên nhiên của núi rất đẹp.,https://natureconservancy-h.assetsadobe.com/is/image/content/dam/tnc/nature/en/photos/w/o/WOPA160517_D056-resized.jpg?crop=864%2C0%2C1728%2C2304&wid=600&hei=800&scl=2.88
教育,giáo dục,教育は未来を作ります。,Giáo dục tạo ra tương lai.,良い教育を受けることが大切です。,Nhận được một nền giáo dục tốt là rất quan trọng.,https://www.forwardpathway.com/wp-content/uploads/2024/07/AI_in_Education_Responsibility_and_Ethics.jpg
文化,văn hoá,日本の文化はとても興味深いです。,Văn hoá Nhật Bản rất thú vị.,私たちは文化祭を開催します。,Chúng tôi sẽ tổ chức lễ hội văn hoá.,https://lookaside.fbsbx.com/lookaside/crawler/media/?media_id=100064916581114
社会,xã hội,社会問題について考えることが大切です。,Suy nghĩ về các vấn đề xã hội là rất quan trọng.,彼は社会学を勉強しています。,Anh ấy đang học xã hội học.,"https://m.media-amazon.com/images/I/61hzp4Kn72L._AC_UF1000,1000_QL80_.jpg"
政治,chính trị,政治に興味がある人が増えています。,Số người quan tâm đến chính trị đang tăng lên.,彼女は政治家になりたいと言っています。,Cô ấy nói rằng muốn trở thành chính trị gia.,https://cn.cdn-news.org/WebView/GetMedia.ashx?PK=000000004d99a1b7a7b18c31752e30448627d47e0db89795&VideoSize=1
法律,pháp luật,法律を守ることは重要です。,Việc tuân thủ pháp luật là rất quan trọng.,彼は法律の専門家です。,Anh ấy là một chuyên gia về pháp luật.,https://zh.gijn.org/wp-content/uploads/2015/09/legal-resources.jpg
戦争,chiến tranh,戦争は多くの人々に影響を与えます。,Chiến tranh ảnh hưởng đến nhiều người.,歴史には多くの戦争がありました。,Lịch sử có nhiều cuộc chiến tranh.,"https://m.media-amazon.com/images/I/A1V-dX2k66L._AC_UF1000,1000_QL80_.jpg"
平和,hoà bình,平和な世界を目指しましょう。,Hãy hướng tới một thế giới hoà bình.,彼は平和活動に参加しています。,Anh ấy tham gia vào các hoạt động vì hoà bình.,https://i.pinimg.com/736x/7c/cf/c1/7ccfc15ef8d8ecb5566f2efd0bb99bcc.jpg
目的,mục đích,私の目的は日本語を上達させることです。,Mục đích của tôi là cải thiện tiếng Nhật.,彼女は明確な目的を持っています。,Cô ấy có một mục đích rõ ràng.,https://www.vine9.com/wp-content/uploads/2018/11/learning-objectives.jpg
論文,luận văn,私は論文を書いています。,Tôi đang viết luận văn.,彼の論文はとても評価されています。,Luận văn của anh ấy được đánh giá rất cao.,https://www.lunwendata.com/special/file/qikanlunwengeshi.png
楽しみ,niềm vui,旅行は私の楽しみの一つです。,Du lịch là một trong những niềm vui của tôi.,彼女は音楽を聴くのが楽しみです。,Cô ấy rất thích nghe nhạc.,https://i2.wp.com/hapaeikaiwa.com/wp_system/wp-content/uploads/2017/01/cant_wait-2.jpg?fit=600%2C400&ssl=1
ミキサー,máy xay,ミキサーでジュースを作ります。,Tôi sẽ làm nước trái cây bằng máy xay.,新しいミキサーを買いました。,Tôi đã mua một cái máy xay mới.,http://enro.jp/cdn/shop/files/Mixer_Set1-2R.jpg?v=1725523056
やかん,ấm đun nước,お湯を沸かすためにやかんを使います。,Tôi sử dụng ấm đun nước để đun sôi nước.,やかんが熱くなったので、気をつけてください。,"Ấm đun nước đã nóng, nên hãy cẩn thận.",https://makeshop-multi-images.akamaized.net/campingmoon/itemimages/000000000762_BzjbvTM.jpg
ふた,nắp,このふたは簡単に外せます。,Nắp này dễ dàng tháo ra.,ふたを閉めてから、冷蔵庫に入れました。,Tôi đã đóng nắp lại rồi cho vào tủ lạnh.,https://hmonline.itembox.design/product/014/000000001461/000000001461-01-m.jpg?t=20241125095943
栓抜き,cái bật nắp chai,ビールを飲むために栓抜きを使います。,Tôi sử dụng cái bật nắp chai để uống bia.,栓抜きが見つからないので、開けられません。,Tôi không thể mở vì không tìm thấy cái bật nắp chai.,https://www.loft.co.jp/shop_assets/img/goods/L/4901601291773-L.jpg
缶切り,cái mở nắp hộp,缶切りでこの hộp thức ăn mở ra nhé。,Hãy mở hộp thức ăn này bằng cái mở nắp hộp.,缶切りを使うと、簡単に開けられます。,"Sử dụng cái mở nắp hộp, bạn có thể mở dễ dàng.",https://tshop.r10s.jp/livingut/cabinet/maker_wahei7/299574.jpg
缶積み,đồ hộp,缶積みは長持ちするので便利です。,Đồ hộp rất tiện lợi vì có thể bảo quản lâu dài.,缶積みを買って、非常食にします。,Tôi sẽ mua đồ hộp để làm thực phẩm dự trữ.,https://www.akashihp.com/wp/wp-content/uploads/2016/11/P1200896_1.jpg
のし袋,phong bì dùng để bỏ tiền mừng,結婚式のためにのし袋を用意しました。,Tôi đã chuẩn bị phong bì để mừng đám cưới.,のし袋にはお金を入れます。,Trong phong bì sẽ có tiền.,https://www.sasagawa-shop.jp/html/upload/save_image/5-2208.jpg
ふろしき,khăn vuông để gói đồ kiểu Nhật,ふろしきを使って、プレゼントを包みました。,Tôi đã sử dụng khăn vuông để gói quà.,ふろしきはエコな方法です。,Khăn vuông là một cách thân thiện với môi trường.,https://www.musubi-online.com/cms/wp-content/uploads/20230313_kanban-3-700x389.jpg
そろばん,bàn bính,子供の頃、そろばんを習いました。,"Khi còn nhỏ, tôi đã học bàn bính.",そろばんを使うと計算が早くなります。,Sử dụng bàn bính giúp tính toán nhanh hơn.,https://img.hncimg.com/image6069/7f0/8dc69ca19ed6aff144d73ba31a7f2568.jpg
体温計,nhiệt kế,体温計で熱を測ります。,Tôi đo nhiệt độ bằng nhiệt kế.,体温計が壊れたので、新しいのを買いました。,Nhiệt kế bị hỏng nên tôi đã mua cái mới.,https://store.healthcare.omron.co.jp/client_info/OMRON6606/itemimage/mc-6740_01.jpg
材料,nguyên liệu,料理の材料を買いに行きます。,Tôi sẽ đi mua nguyên liệu nấu ăn.,このケーキの材料はとても新鮮です。,Nguyên liệu của chiếc bánh này rất tươi.,http://www.cdb.cas.cn/kyzc/kysb/201311/W020131118386401926655.jpg
ある〜,một ~ nọ,ある日、彼は公園で猫を見つけました。,"Một ngày nọ, anh ấy đã tìm thấy một con mèo trong công viên.",ある本を読んで、とても感動しました。,Tôi đã đọc một cuốn sách nọ và cảm thấy rất xúc động.,https://i.ytimg.com/vi/3QwrNQi3ccA/maxresdefault.jpg
一生懸命,chăm chỉ,彼は一生懸命勉強しています。,Anh ấy đang học tập chăm chỉ.,一生懸命働いて、昇進しました。,Tôi đã làm việc chăm chỉ và được thăng chức.,https://lookaside.fbsbx.com/lookaside/crawler/media/?media_id=2495996220632700
なぜ,tại sao,なぜ遅れたのですか？,Tại sao bạn lại đến muộn?,なぜ彼はその映画を見たくないのですか？,Tại sao anh ấy không muốn xem bộ phim đó?,https://cdn-ak.f.st-hatena.com/images/fotolife/n/nativecamp_official/20221209/20221209091345.png
どのくらい,bao nhiêu,この本はどのくらいの値段ですか？,Cuốn sách này giá bao nhiêu?,どのくらい時間がかかりますか？,Mất bao nhiêu thời gian?,https://rarejob.com/cms/wp-content/uploads/2020/09/201002-750x500.jpg
国連,Liên Hợp Quốc,国連は世界の平和を守るために活動しています。,Liên Hợp Quốc hoạt động để bảo vệ hòa bình thế giới.,国連の会議に参加しました。,Tôi đã tham gia một cuộc họp của Liên Hợp Quốc.,https://www.un.emb-japan.go.jp/files/100729697.jpg
子供ニュース,bản tin thiếu nhi,毎週、子供ニュースを見ています。,Tôi xem bản tin thiếu nhi mỗi tuần.,子供ニュースは楽しい内容が多いです。,Bản tin thiếu nhi có nhiều nội dung thú vị.,https://i.ytimg.com/vi/JjANrhJOX_4/maxresdefault.jpg
ボーナスが出ます,có (thưởng),今年はボーナスが出ます。,Năm nay sẽ có thưởng.,彼はボーナスが出て、旅行に行きました。,Anh ấy đã có thưởng và đi du lịch.,https://miyakoweb.jp/blog/wp-content/uploads/2020/07/bonus.png
半分,một nửa,このケーキを半分に切ってください。,Xin hãy cắt chiếc bánh này thành một nửa.,半分の時間で宿題を終えました。,Tôi đã hoàn thành bài tập trong một nửa thời gian.,"https://m.media-amazon.com/images/I/81ypsvcfZeL._AC_UF1000,1000_QL80_.jpg"
ローン,khoản vay ngân hàng,家を買うためにローンを組みました。,Tôi đã vay ngân hàng để mua nhà.,ローンの返済が大変です。,Việc trả nợ vay rất khó khăn.,https://www.sompo-japan.co.jp/webloan/smp/images/sp_main_image.png?230901
カップめん,mỳ ăn liền,カップめんは簡単に作れます。,Mỳ ăn liền rất dễ làm.,お腹が空いたので、カップめんを食べました。,Tôi đói nên đã ăn mỳ ăn liền.,https://www.momastore.jp/img/goods/2/4964729378856_2_detail.jpg
世界初,đầu tiên trên thế giới,この技術は世界初のものです。,Công nghệ này là cái đầu tiên trên thế giới.,彼は世界初の宇宙旅行者になりました。,Anh ấy đã trở thành du khách vũ trụ đầu tiên trên thế giới.,https://t.pimg.jp/040/011/955/1/40011955.jpg
〜によって,bởi ~,この本は多くの人によって書かれました。,Cuốn sách này được viết bởi nhiều người.,問題は技術によって解決されます。,Vấn đề sẽ được giải quyết bởi công nghệ.,https://jlptsensei.com/wp-content/uploads/2020/02/ni-yotte-%E3%81%AB%E3%82%88%E3%81%A3%E3%81%A6-jlpt-n3-grammar-meaning-%E6%96%87%E6%B3%95-%E4%BE%8B%E6%96%87-japanese-flashcards.png
どんぶり,bát tô lớn,どんぶりにご飯を盛ります。,Tôi cho cơm vào bát tô lớn.,彼はどんぶりでラーメンを食べています。,Anh ấy đang ăn mì trong bát tô lớn.,https://www.myojousa.com/wp-content/uploads/2023/12/Featured-Image-min.jpg
めん,mì sợi,このめんはとても美味しいです。,Mì này rất ngon.,めんを茹でる時間は5分です。,Thời gian nấu mì là 5 phút.,https://menoh.com/_src/14574/b15_001_billboard_%281%29.jpg?v=1727763339987
広めます,phổ cập,新しい情報を広めます。,Tôi sẽ phổ cập thông tin mới.,彼は文化を広める活動をしています。,Anh ấy đang hoạt động để phổ cập văn hóa.,https://www.tanoshiijapanese.com/dictionary/entry_preview/5/26549/37021.png
市場調査,điều tra thị trường,私たちは市場調査を行います。,Chúng tôi sẽ tiến hành điều tra thị trường.,市場調査の結果が出ました。,Kết quả điều tra thị trường đã có.,https://mms.businesswire.com/media/20240711770114/ja/2183514/5/NEWIntersolar_2024_Annual_Solar_PV_Installed_Capacity.jpg
割ります,bẻ ra,このチョコレートを割ります。,Tôi sẽ bẻ miếng sô cô la này ra.,彼は木を割って薪を作ります。,Anh ấy bẻ cây để làm củi.,https://www.tanoshiijapanese.com/dictionary/entry_preview/5/19696/28902.png
注ぎます,đổ vào,お茶をカップに注ぎます。,Tôi đổ trà vào cốc.,水を注いでください。,Xin hãy đổ nước vào.,https://www.tanoshiijapanese.com/dictionary/entry_preview/5/56112/72177.png
輸出が増えます,xuất khẩu tăng,今年、輸出が増えました。,"Năm nay, xuất khẩu đã tăng.",新しい市場のおかげで輸出が増えています。,"Nhờ vào thị trường mới, xuất khẩu đang tăng.",https://nihongopic.com/wp-content/uploads/2019/09/d9627ba42a63b5f8ee9dded998e5f6ae.png
輸出が減ります,xuất khẩu giảm,経済の影響で輸出が減ります。,"Do ảnh hưởng của kinh tế, xuất khẩu giảm.",輸出が減ると、会社は困ります。,"Khi xuất khẩu giảm, công ty sẽ gặp khó khăn.",https://nihongopic.com/wp-content/uploads/2019/09/8f93e783f264c6e6a030af39e432eef6.png
値段が上がります,giá cả tăng,この商品は人気があるので、値段が上がります。,Sản phẩm này rất được ưa chuộng nên giá cả sẽ tăng.,来月から値段が上がるので、今のうちに買っておきましょう。,"Giá sẽ tăng từ tháng sau, nên hãy mua ngay bây giờ.",https://nihongopic.com/wp-content/uploads/2019/09/5600489dac9e062be705eabd4da431ff.png
値段が下がります,giá cả giảm,セール中なので、値段が下がります。,"Vì đang trong đợt giảm giá, giá cả sẽ giảm.",この商品は古くなったので、値段が下がります。,Sản phẩm này đã cũ nên giá sẽ giảm.,https://lookaside.fbsbx.com/lookaside/crawler/media/?media_id=1262315098196702
ひもが切れます,sợi dây bị đứt,強く引っ張ったら、ひもが切れました。,"Khi kéo mạnh, sợi dây đã bị đứt.",このひもは古いので、すぐに切れます。,Sợi dây này đã cũ nên dễ bị đứt.,https://langoal.com/images/43-%E2%80%93-5.png
ボタンがとれます,cúc áo bị đứt,シャツのボタンがとれたので、縫い直さなければなりません。,Cúc áo của áo sơ mi đã bị đứt nên tôi phải khâu lại.,このコートのボタンがとれそうです。,Cúc áo của chiếc áo khoác này có vẻ sắp bị đứt.,https://blogimg.goo.ne.jp/user_image/42/c7/94ef6f84c44caa101cdb5a1b6204975a.jpg
荷物が落ちます,hành lí bị rơi,電車の中で荷物が落ちてしまいました。,Hành lý đã bị rơi trong tàu điện.,階段を下りるときに荷物が落ちました。,"Khi xuống cầu thang, hành lý đã bị rơi.",https://langoal.com/images/43-%E2%80%93-7.png
ガソリンがなくなります,xăng hết,運転中にガソリンがなくなりそうです。,"Trong khi lái xe, có vẻ như xăng sắp hết.",ガソリンがなくなる前に、給油しなければなりません。,"Trước khi hết xăng, tôi phải đổ xăng.",https://img.goo-net.com/sss/magazine/2022/10/18/1666072560.jpg
変（な）,lạ,この料理はちょっと変な味がします。,Món ăn này có vị hơi lạ.,彼の行動は変だと思います。,Tôi nghĩ hành động của anh ấy thật lạ.,https://www.hennnahotel.com/ginza/wp-content/uploads/2024/01/image0-2.jpeg
幸せ（な）,hạnh phúc,家族と一緒にいると、とても幸せです。,"Khi ở bên gia đình, tôi rất hạnh phúc.",彼女は幸せそうな笑顔をしています。,Cô ấy đang có một nụ cười hạnh phúc.,https://pbs.twimg.com/profile_images/1580649742245036033/WVCqAyhK_400x400.png
楽（な）,nhàn,この仕事は楽なので、すぐに終わります。,Công việc này nhàn nên sẽ kết thúc nhanh chóng.,楽な椅子に座って、リラックスしましょう。,Hãy ngồi vào chiếc ghế nhàn và thư giãn nào.,https://j-sen-blog.g.kuroco-img.app/v=1640338363/files/topics/2163_ext_01_0.jpg
うまい,ngon,このラーメンは本当にうまいです。,Món ramen này thật sự rất ngon.,彼の料理はいつもとても美味しいうまいです。,Món ăn của anh ấy lúc nào cũng rất ngon.,https://makeshop-multi-images.akamaized.net/sankanoh/itemimages/000000000012_TZE50k2.jpg
まずい,dở,この料理はまずいです。,Món ăn này dở quá.,彼の歌はいつもまずい。,Bài hát của anh ấy lúc nào cũng dở.,https://choden-mazuibou.com/images/15th/sp-main.png
つまらない,chán,この映画はつまらないと思います。,Tôi nghĩ bộ phim này chán quá.,授業がつまらないので、眠くなります。,Vì tiết học chán nên tôi thấy buồn ngủ.,"https://m.media-amazon.com/images/I/71pa91jW3OL._AC_UF1000,1000_QL80_.jpg"
優しい,hiền lành,彼女はとても優しい人です。,Cô ấy là một người rất hiền lành.,優しい言葉をかけてくれました。,Cô ấy đã nói những lời hiền lành với tôi.,https://www.ponycanyon.co.jp/images/wcms/accessor/bin/jacket/PCBC000050727.jpg?size=4&order=1
ガソリン,xăng,車にガソリンを入れなければなりません。,Tôi phải đổ xăng cho xe.,ガソリンの値段が上がっています。,Giá xăng đang tăng lên.,https://cdn-ak.f.st-hatena.com/images/fotolife/c/camper22koguma/20240926/20240926174353.jpg
火,lửa,火を消してください。,Hãy dập lửa đi.,キャンプで火を焚きました。,Tôi đã nhóm lửa trong buổi cắm trại.,https://img.caixin.com/2025-01-10/173648591636510.jpg
パンフレット,tờ rơi quảng cáo,このパンフレットを見てください。,Hãy xem tờ rơi này.,新しいレストランのパンフレットをもらいました。,Tôi đã nhận được tờ rơi quảng cáo của nhà hàng mới.,https://www.seven-brooks.com/img/sw/sw-t7.jpg
今にも,bất kì lúc nào,今にも雨が降りそうです。,Có vẻ như trời sắp mưa bất kỳ lúc nào.,彼は今にも泣き出しそうです。,Anh ấy có vẻ như sắp khóc bất kỳ lúc nào.,https://livedoor.blogimg.jp/edewakaru/imgs/f/6/f680e60c.jpg
わあ,True,わあ、すごい景色ですね！,"Wow, cảnh đẹp quá nhỉ!",わあ、あなたのドレスは素敵です！,"Wow, chiếc váy của bạn thật đẹp!",https://profile.yoshimoto.co.jp/assets/data/profile/10957/1938299552db96bd2e169a380bc64e3e71c9e725.jpg
ばら,hoa hồng,彼女にばらの花を贈りました。,Tôi đã tặng cô ấy một bông hoa hồng.,庭にばらが咲いています。,Trong vườn có hoa hồng đang nở.,https://baseec-img-mng.akamaized.net/images/item/origin/e64726c9a4de0d6707b5a0828e23dc81.jpg?imformat=generic
ドライバ,lái xe ô tô (sở thích),彼はドライバとして働いています。,Anh ấy làm việc như một tài xế.,週末にドライバを楽しみます。,Cuối tuần tôi thích lái xe.,https://ktc.jp/files/catalog/photos_l/d7p-1~3.png
理由,lí do,彼は遅れた理由を説明しました。,Anh ấy đã giải thích lý do đến muộn.,私にはその決定の理由がわかりません。,Tôi không hiểu lý do cho quyết định đó.,"https://bkimg.cdn.bcebos.com/smart/b3119313b07eca80653820c6b36f80dda144ad3425f4-bkimg-process,v_1,rw_1,rh_1,pad_1,color_ffffff?x-bce-process=image/format,f_auto"
謝ります,xin lỗi,彼に謝ります。,Tôi xin lỗi anh ấy.,間違えたことを謝ります。,Tôi xin lỗi vì đã sai.,https://www.tanoshiijapanese.com/dictionary/entry_preview/5/30914/42098.png
知り合います,quen biết,新しい友達と知り合いました。,Tôi đã quen biết một người bạn mới.,彼女と知り合うのが楽しみです。,Tôi rất mong được quen biết cô ấy.,https://blogimg.goo.ne.jp/user_image/10/28/bbc1e35561f2ec6182d3b3a37203b23a.jpg
