word,meaning,example_sentences_1,meaning_example_sentences_1,example_sentences_2,meaning_example_sentences_2,image_url
残ります,ở lại,彼は最後まで残ります。,Anh ấy sẽ ở lại đến cuối cùng.,この食べ物は残りますか？,Thức ăn này có còn lại không?,https://www.tanoshiijapanese.com/dictionary/entry_preview/5/29094/39986.png
入学試験,kì thi đầu vào,入学試験は来週です。,Kỳ thi đầu vào sẽ diễn ra vào tuần tới.,彼は入学試験に合格しました。,Anh ấy đã đậu kỳ thi đầu vào.,https://www.hmc.ac.jp/wp/wp-content/uploads/2023/02/cod50676.jpg
月に,(trong) một tháng,月に一度、会議があります。,Mỗi tháng có một cuộc họp.,彼は月に二回、旅行します。,Anh ấy đi du lịch hai lần trong một tháng.,https://www.ukiyoe-ota-muse.jp/wp-content/uploads/exhibition/2013_hiroshige-tsukinikari/01.jpg
村,làng,この村はとても静かです。,Làng này rất yên tĩnh.,村の人々は親切です。,Người dân trong làng rất thân thiện.,https://toho-info.com/img/top/mv01.jpg
卒業します,tốt nghiệp,彼は来年卒業します。,Anh ấy sẽ tốt nghiệp vào năm tới.,私は大学を卒業しました。,Tôi đã tốt nghiệp đại học.,https://prtimes.jp/i/888/1029/resize/d888-1029-291787-0.jpg
映画館,rạp phim,映画館で映画を見ました。,Tôi đã xem phim ở rạp chiếu phim.,映画館は混んでいました。,Rạp phim rất đông.,https://i.ytimg.com/vi/HSLeBRcTxC0/maxresdefault.jpg
嫌（な）,chán,この仕事は嫌です。,Công việc này thì chán.,彼は嫌な人です。,Anh ấy là một người chán.,https://www.shochiku.co.jp/wp-content/uploads/2020/06/DB_20200604_12.jpg
空,bầu trời,空は青いです。,Bầu trời thì màu xanh.,夜の空には星が見えます。,Trên bầu trời đêm có thể thấy các vì sao.,https://www.strokeorder.com/assets/bishun/animation/31354.gif
閉じます,nhắm,目を閉じます。,Tôi nhắm mắt lại.,本を閉じます。,Tôi đóng sách lại.,https://lookaside.fbsbx.com/lookaside/crawler/media/?media_id=153841912891309
都会,thành phố,都会は賑やかです。,Thành phố thì nhộn nhịp.,私は都会に住んでいます。,Tôi sống ở thành phố.,https://img.meilvtong.com/dataHouse2/US//month_2_2212/2212161102f4fc2d37a0455cd2.jpg
子どもたち,trẻ con,子どもたちは公園で遊んでいます。,Trẻ con đang chơi ở công viên.,子どもたちが笑っています。,Trẻ con đang cười.,https://itabashi-kodomonoibasho.net/images/main.jpg
自由に,thoải mái,ここでは自由に遊んでいいです。,Ở đây thì có thể chơi thoải mái.,自由に考えてください。,Hãy suy nghĩ thoải mái.,https://www.kawade.co.jp/img/cover_l/9784309032054.jpg
運動します,vận động,毎日運動します。,Tôi vận động mỗi ngày.,運動することは大切です。,Việc vận động là rất quan trọng.,https://nihongopic.com/wp-content/uploads/2019/09/0d340bd5d8045e3598d3e2f7c4e9cb66.png
成功します,thành công,彼はビジネスで成功しました。,Anh ấy đã thành công trong kinh doanh.,努力すれば成功します。,Nếu cố gắng thì sẽ thành công.,https://nihongopic.com/wp-content/uploads/2019/09/3265a98812766d05e233bde672ee9907.png
試験に失敗します,trượt (kì thi),私は試験に失敗しました。,Tôi đã trượt kỳ thi.,彼は試験に失敗することを恐れています。,Anh ấy sợ trượt kỳ thi.,https://nihongopic.com/wp-content/uploads/2019/09/a419aafeafb5f792543a3be07f0b00e0.png
試験に合格します,đỗ (kì thi),試験に合格して嬉しいです。,Tôi rất vui vì đã đỗ kỳ thi.,彼女は試験に合格しました。,Cô ấy đã đỗ kỳ thi.,https://t.pimg.jp/067/873/181/1/67873181.jpg
雨がやみます,tạnh mưa,雨がやみました。これから出かけましょう。,Mưa đã tạnh. Chúng ta hãy ra ngoài nào.,明日は雨がやむといいですね。,Hy vọng ngày mai mưa sẽ tạnh.,https://nihongopic.com/wp-content/uploads/2019/09/a66ed1eae00cb7dda9713cd1b594b223.png
晴れます,quang dãng,今日は晴れています。ピクニックに行きましょう。,Hôm nay trời quang đãng. Chúng ta hãy đi dã ngoại.,晴れた日が好きです。,Tôi thích những ngày trời quang đãng.,https://www.tanoshiijapanese.com/dictionary/entry_preview/5/36150/48254.png
曇ります,có mây,今日は曇っています。雨が降るかもしれません。,Hôm nay có mây. Có thể trời sẽ mưa.,曇りの日は気分が落ち込みます。,Những ngày có mây khiến tôi cảm thấy buồn.,https://www.tanoshiijapanese.com/dictionary/entry_preview/5/44062/57381.png
熱が続きます,sốt kéo dài,熱が続いているので、病院に行きます。,"Vì sốt kéo dài, tôi sẽ đi bệnh viện.",熱が続くと、体がだるくなります。,"Khi sốt kéo dài, cơ thể sẽ cảm thấy mệt mỏi.",https://nihongopic.com/wp-content/uploads/2019/09/ecd45d3ac0f63b7ae75cf0e3fac51c1c.png
かぜをひきます,bị cảm,最近、風邪をひいてしまいました。,"Gần đây, tôi đã bị cảm.",風邪をひかないように、暖かくしてください。,Hãy giữ ấm để không bị cảm.,https://www.welpark.jp/kikaku/kaze-taisaku/images/9cam-img15.jpg
冷やします,làm mát,飲み物を冷やします。,Tôi sẽ làm mát đồ uống.,このスープは冷やしてから食べます。,Món súp này sẽ được ăn sau khi làm mát.,https://blogimg.goo.ne.jp/user_image/11/b6/306186429208e8c0490ff9e9a921c8e2.jpg
道が込みます,đường đông,朝は道が込みますので、早めに出発します。,"Vào buổi sáng, đường đông nên tôi sẽ khởi hành sớm.",週末は道が込みやすいです。,Cuối tuần thì đường thường đông.,https://langoal.com/images/29-%E2%80%93-5.png
道がすきます,đường vắng,夜は道がすいています。,"Vào ban đêm, đường vắng.",早朝は道がすいていて、運転しやすいです。,"Vào sáng sớm, đường vắng và dễ lái xe.",https://langoal.com/images/29-%E2%80%93-6.png
試合に出ます,tham gia trận đấu,明日の試合に出ます。,Tôi sẽ tham gia trận đấu ngày mai.,彼はサッカーの試合に出ることが好きです。,Anh ấy thích tham gia các trận đấu bóng đá.,https://jice.homemate.co.jp/isc/useful/14328_sport_001/img/14328_sport_001_29.jpg
パーティーに出ます,dự tiệc,今晩のパーティーに出ます。,Tôi sẽ dự tiệc tối nay.,友達と一緒にパーティーに出ます。,Tôi sẽ dự tiệc cùng với bạn bè.,https://static.amanaimages.com/imgroom/rf_preview640/33100/33100000085.jpg
無理をします,gắng sức,試験のために無理をしますが、体を大切にしてください。,"Tôi sẽ gắng sức cho kỳ thi, nhưng hãy chăm sóc sức khỏe của bạn.",彼は仕事のために無理をして、体調を崩しました。,Anh ấy đã gắng sức vì công việc và đã bị ốm.,https://livedoor.blogimg.jp/edewakaru/imgs/a/4/a4f61c1c.jpg
十分（な）,đủ,このお金は十分ですか？,Số tiền này có đủ không?,十分な時間があれば、もっと勉強できます。,"Nếu có đủ thời gian, tôi có thể học nhiều hơn.",https://picdic.jp/wp-content/uploads/2022/11/11A59DA6-FFB4-41B5-AB5B-B62286A7BDAD-1024x670.jpeg
おかしい,kì lạ,この話はおかしいと思います。,Tôi nghĩ câu chuyện này thật kì lạ.,彼の行動はおかしいです。,Hành động của anh ấy thật kì lạ.,https://i.ytimg.com/vi/mKYDkr-1KA4/hq720.jpg?sqp=-oaymwEhCK4FEIIDSFryq4qpAxMIARUAAAAAGAElAADIQj0AgKJD&rs=AOn4CLATTqETGuNMBV91EONvz95kDPal0w
うるさい,ồn ào,隣の部屋がうるさいので、眠れません。,Phòng bên cạnh ồn ào quá nên tôi không thể ngủ được.,子供たちが遊んでいて、うるさいです。,Bọn trẻ đang chơi và thật ồn ào.,https://i.ytimg.com/vi/ZQcLr1KXFLc/maxresdefault.jpg
先生,bác sĩ,私の先生はとても優しいです。,Bác sĩ của tôi rất tốt bụng.,先生に相談してみてください。,Hãy thử hỏi bác sĩ.,https://upload.wikimedia.org/wikipedia/zh/thumb/9/9b/The_Movie_Emperor_poster.jpg/220px-The_Movie_Emperor_poster.jpg
やけどをします,bỏng,熱いお湯でやけどをしました。,Tôi đã bị bỏng do nước nóng.,料理中にやけどをしないように気をつけてください。,Hãy cẩn thận để không bị bỏng khi nấu ăn.,https://www.jsswc.or.jp/general/images/yakedo_img.png
けがをします,bị thương,サッカーをしていて、けがをしました。,Tôi đã bị thương khi chơi bóng đá.,彼は転んでけがをしました。,Anh ấy đã bị thương khi ngã.,https://tokunaka-clinic.com/blog/wp-content/uploads/2019/01/sports_soccer_kega.png
せきをします,ho,風邪をひいて、せきをします。,Tôi bị cảm và đang ho.,彼女はせきをして、マスクをしました。,Cô ấy ho và đã đeo khẩu trang.,https://www.keiseikai.net/assets/images/medicalinformation/img-others-longcough-01.png
せきが出ます,ho,最近、せきが出ます。,"Gần đây, tôi hay bị ho.",せきが出るので、病院に行きます。,Tôi sẽ đi bệnh viện vì tôi bị ho.,http://hitomedical.co-site.jp/wp2017/wp-content/uploads/2020/01/virus_seki-246x300.png
インフルエンザ,cúm,インフルエンザにかかって、学校を休みました。,Tôi đã bị cúm và nghỉ học.,インフルエンザの予防接種を受けました。,Tôi đã tiêm phòng cúm.,https://idaten.clinic/wp-content/uploads/2024/11/LINE_eyecatch_1676x1088-95.png
空,bầu trời,今日は空が青いです。,Hôm nay bầu trời trong xanh.,空にはたくさんの雲があります。,Trên bầu trời có rất nhiều mây.,https://www.strokeorder.com/assets/bishun/animation/31354.gif
太陽,mặt trời,太陽が昇ると、明るくなります。,"Khi mặt trời mọc, mọi thứ trở nên sáng sủa.",太陽の光はとても暖かいです。,Ánh sáng của mặt trời rất ấm áp.,https://taiwandaily.net/wp-content/uploads/2024/10/4821596_1_1.jpg
星,sao,夜空に星が輝いています。,Các ngôi sao đang tỏa sáng trên bầu trời đêm.,星を見上げるのが好きです。,Tôi thích ngắm nhìn các ngôi sao.,https://image.api.playstation.com/vulcan/ap/rnd/202401/2211/27d8c2b09bd5ee09762b9a5acf2860344bdc6b1aa77862e4.png
かぜ,gió,今日は風が強いです。,Hôm nay gió rất mạnh.,風が吹いて、気持ちがいいです。,Gió thổi làm cho cảm giác thật dễ chịu.,https://www.nicho.co.jp/images/sp-m/941/
東,đông,太陽は東から昇ります。,Mặt trời mọc từ phía đông.,私の家は東にあります。,Nhà tôi ở phía đông.,https://www.ejable.com/wp-content/uploads/2024/04/higashi-strokes-1.webp
西,tây,西の空が赤くなっています。,Bầu trời phía tây đang chuyển sang màu đỏ.,彼は西に向かって歩いています。,Anh ấy đang đi về phía tây.,https://www.strokeorder.com/assets/bishun/animation/35199.gif
南,nam,南の方角に行きましょう。,Hãy đi về hướng nam.,南風が心地よいです。,Gió nam thật dễ chịu.,http://bishun.strokeorder.info/characters/137570.gif
北,bắc,北の国は寒いです。,Các nước phía bắc thì lạnh.,北へ行くと、雪が見えます。,"Khi đi về phía bắc, bạn sẽ thấy tuyết.",https://www.strokeorder.com/assets/bishun/animation/21271.gif
〜国際,True,国際会議が開かれます。,Một hội nghị quốc tế sẽ được tổ chức.,国際的な問題について話しましょう。,Hãy nói về các vấn đề quốc tế.,https://i0.wp.com/ciscotours.com/wp-content/uploads/2020/05/%E7%A9%BA%E6%B8%AF%E5%85%A8%E4%BD%93.jpg?resize=1024%2C758&quality=89&ssl=1
水道,nước máy,水道から水を飲みます。,Tôi uống nước từ vòi nước.,水道が壊れています。,Vòi nước bị hỏng.,http://image.ayskjaj.com/acupoint/1695181554331.jpg
エンジン,động cơ,この車のエンジンはとても強いです。,Động cơ của chiếc xe này rất mạnh.,エンジンが故障したので、修理に出しました。,"Vì động cơ bị hỏng, tôi đã mang đi sửa.",https://www.amberpiece.com/content/images/harley-m-eight/01.jpg
チーム,đội,私たちのチームは優勝しました。,Đội của chúng tôi đã giành chiến thắng.,新しいチームメンバーが加わりました。,Có một thành viên mới gia nhập đội.,https://i.ytimg.com/vi/zS4r0SjyDOI/maxresdefault.jpg
今夜,tối nay,今夜は映画を見に行きます。,Tối nay tôi sẽ đi xem phim.,今夜の天気はどうですか？,Thời tiết tối nay thế nào?,https://i.ytimg.com/vi/h3G1aZgPReU/sddefault.jpg
夕方,chiều tối,夕方に友達と会います。,Chiều tối tôi sẽ gặp bạn.,夕方は涼しくなります。,Chiều tối thì trở nên mát mẻ.,https://upload.wikimedia.org/wikipedia/commons/c/ca/%E5%A4%95%E6%96%B9%E3%81%A8%E5%A4%9C%E3%81%AE%E4%B8%AD%E9%96%93%E3%81%AE%E7%A9%BA.JPG
まえ,trước,彼は私のまえに立っています。,Anh ấy đang đứng trước tôi.,まえに行ったレストランは美味しかった。,Nhà hàng mà tôi đã đi trước đây rất ngon.,https://www.thejapanesepage.com/wp-content/uploads/2022/05/1-2.png
遅く,muộn,遅くまで働くのは大変です。,Làm việc muộn thì rất vất vả.,遅くなってごめんなさい。,Xin lỗi vì đã đến muộn.,https://i.ytimg.com/vi/r2Fwo6QF00k/maxresdefault.jpg
こんなに,như thế này,こんなに美しい景色は見たことがない。,Tôi chưa bao giờ thấy cảnh đẹp như thế này.,こんなに簡単な問題は誰でも解ける。,Vấn đề dễ như thế này ai cũng có thể giải quyết.,"https://m.media-amazon.com/images/I/71zGBogb+iL._AC_UF1000,1000_QL80_.jpg"
そんなに,như thế đó,そんなに高いものは買えません。,Tôi không thể mua những thứ đắt như thế đó.,そんなに急がなくても大丈夫です。,Bạn không cần phải vội như thế đâu.,https://jlptsensei.com/wp-content/uploads/2020/01/sonna-ni-%E3%81%9D%E3%82%93%E3%81%AA%E3%81%AB-%E3%81%9D%E3%82%93%E3%81%AA%E3%81%AB-jlpt-n4-grammar-meaning-%E6%96%87%E6%B3%95-%E4%BE%8B%E6%96%87-japanese-flashcards.png
あんなに,như thế kia (những điều),あんなに大きな声で話さないでください。,Xin đừng nói to như thế kia.,あんなに遠くに行くのは大変です。,Đi xa như thế kia thì rất khó.,"https://m.media-amazon.com/images/I/61-sc3XRS4S._AC_UF1000,1000_QL80_.jpg"
ヨーロッパ,châu Âu,ヨーロッパには多くの国があります。,Châu Âu có nhiều quốc gia.,私はヨーロッパを旅行したいです。,Tôi muốn đi du lịch châu Âu.,https://i.ytimg.com/vi/_dQG7oMXoKE/hq720.jpg?sqp=-oaymwEhCK4FEIIDSFryq4qpAxMIARUAAAAAGAElAADIQj0AgKJD&rs=AOn4CLDacs7KJcGGJJNdbF4aWj0fbFZJMg
元気,khoẻ,毎朝、元気にジョギングをしています。,"Mỗi sáng, tôi chạy bộ một cách khỏe khoắn.",彼は元気そうですね。,Anh ấy có vẻ khỏe mạnh nhỉ.,https://yt3.googleusercontent.com/7mg-RuWPHI-_-AKdElyGI705bp3e2G045dBMxVR-WQRFpQOueBsIH-aUNUldRfr0joIrGlJPd4Q=s900-c-k-c0x00ffffff-no-rj
胃,dạ dày,胃が痛いので、病院に行きました。,Tôi đã đi bệnh viện vì đau dạ dày.,彼女は胃の調子が悪いです。,Cô ấy có vấn đề về dạ dày.,https://assets.mayoclinic.org/content/dam/media/en/images/2023/02/09/stomach-and-pyloric-valve.jpg
ストレス,căng thẳng,仕事のストレスがたまっています。,Tôi đang bị căng thẳng vì công việc.,ストレスを解消するために、運動をします。,Tôi tập thể dục để giảm căng thẳng.,https://www.newtonpress.co.jp/dcms_media/image/mook-cover_230414_1-1.jpg
それはいけませんね,thế thì ko được,遅刻するのはそれはいけませんね。,Đến muộn thì không được đâu.,そんなことを言うのはそれはいけませんね。,Nói như vậy thì không được.,https://www.satsukita-office.jp/wp-content/uploads/2017/12/shinpai_ojisan.png
星占い,bói sao,毎朝、星占いをチェックします。,Tôi kiểm tra bói sao mỗi sáng.,星占いによると、今日は良い日です。,"Theo bói sao, hôm nay là một ngày tốt.",https://image.jadore-jun.jp/spinoza/entry/image/2021/12/23/61c40269de8d7_1.png
牡牛座,sao Kim ngưu,私は牡牛座です。,Tôi thuộc cung Kim Ngưu.,牡牛座の人は、安定を好むと言われています。,Người thuộc cung Kim Ngưu thường được cho là thích sự ổn định.,https://t4.ftcdn.net/jpg/01/71/00/17/360_F_171001748_o2b1rC4Vi6HDgkDSSqodvwBYLa0YA3cp.jpg
働きすぎ,làm việc quá sức,働きすぎは体に良くないです。,Làm việc quá sức không tốt cho cơ thể.,彼は働きすぎで疲れています。,Anh ấy mệt mỏi vì làm việc quá sức.,https://sanchie.net/wp-content/uploads/2023/05/pixta_80926030_M-1-min.jpg
困ります,khó khăn,お金がないと困ります。,Không có tiền thì thật khó khăn.,困りますので、助けてください。,"Tôi gặp khó khăn, xin hãy giúp tôi.",https://stickershop.line-scdn.net/stickershop/v1/product/16617708/LINEStorePC/main.png?v=1
宝くじ,vé sổ,宝くじを買いました。,Tôi đã mua vé số.,宝くじが当たったら、旅行に行きたいです。,"Nếu trúng số, tôi muốn đi du lịch.",https://www.takarakuji-official.jp/assets/img/guide/pic-howto-buy001.png
宝くじが当たります,trúng số,宝くじが当たりますように。,Mong rằng tôi sẽ trúng số.,彼は宝くじが当たったと言っています。,Anh ấy nói rằng đã trúng số.,https://www.happy-kichizokun.jp/blog/media-031/wp-content/webpc-passthru.php?src=https://www.happy-kichizokun.jp/blog/media-031/wp-content/uploads/2019/11/44d753725da0bb978e5b8f2207f5d7ff-300x232.png&nocache=1
健康,sức khoẻ,毎日運動することは健康に良いです。,Việc tập thể dục mỗi ngày tốt cho sức khoẻ.,健康診断を受けることが大切です。,Việc kiểm tra sức khoẻ là rất quan trọng.,https://nutritionsource.hsph.harvard.edu/wp-content/uploads/2014/11/Chinese_Simplified_HEP_July20141.jpg
恋愛,tình yêu,恋愛は時々難しいですが、楽しいです。,Tình yêu đôi khi khó khăn nhưng cũng rất vui.,彼女との恋愛は特別な思い出です。,Tình yêu với cô ấy là những kỷ niệm đặc biệt.,https://image.p-c2-x.abema-tv.com/image/programs/90-1739_s10_p1/thumb002.png?background=000000&fit=fill&height=432&quality=75&version=1695377636&width=768
恋人,người yêu,私の恋人はとても優しいです。,Người yêu của tôi rất tốt bụng.,彼は私の初めての恋人です。,Anh ấy là người yêu đầu tiên của tôi.,https://dynamic-media-cdn.tripadvisor.com/media/photo-o/27/a4/bb/60/caption.jpg?w=900&h=500&s=1
ラッキーアイテム,thức được cho làm đem lại vận may trong bói toán,このペンダントは私のラッキーアイテムです。,Chiếc vòng cổ này là vật đem lại vận may cho tôi.,ラッキーアイテムを持っていると、運が良くなる気がします。,"Tôi cảm thấy nếu có vật đem lại vận may, thì sẽ gặp nhiều may mắn.",https://as1.ftcdn.net/v2/jpg/01/19/59/06/1000_F_119590688_w8OS0xV26G70m2GP6uW83AJAVr1RrsYe.jpg
石,hòn đá,公園で大きな石を見つけました。,Tôi đã tìm thấy một hòn đá lớn trong công viên.,この石はとても重いです。,Hòn đá này rất nặng.,https://p3.img.cctvpic.com/photoworkspace/contentimg/2023/09/21/2023092112305497258.jpg
逃げます,trốn,彼は犬から逃げました。,Anh ấy đã trốn khỏi con chó.,危険な状況から逃げることが大切です。,Việc trốn khỏi tình huống nguy hiểm là rất quan trọng.,https://nihongopic.com/wp-content/uploads/2019/09/f76ee64fd5e4a08426a51b478a8f1693.png
騒ぎます,làm ồn,子供たちが公園で騒いでいます。,Bọn trẻ đang làm ồn trong công viên.,パーティーで騒ぎすぎないようにしましょう。,Hãy cố gắng không làm ồn quá mức trong bữa tiệc.,https://www.tanoshiijapanese.com/dictionary/entry_preview/5/38752/51295.png
諦めます,bỏ cuộc,難しい問題でも諦めないでください。,"Dù vấn đề khó khăn, hãy đừng bỏ cuộc.",彼は夢を諦めませんでした。,Anh ấy đã không bỏ cuộc với ước mơ của mình.,https://www.tanoshiijapanese.com/dictionary/entry_preview/5/42043/55069.png
投げます,ném,ボールを遠くに投げました。,Tôi đã ném bóng đi xa.,彼女は石を湖に投げました。,Cô ấy đã ném hòn đá xuống hồ.,https://upload.wikimedia.org/wikipedia/commons/thumb/b/b2/%E6%8A%95%E3%81%92%E3%81%BE%E3%81%99_%2831879540%29.jpg/1200px-%E6%8A%95%E3%81%92%E3%81%BE%E3%81%99_%2831879540%29.jpg
守ります,giữ (lời hứa) tuân thủ (quy tắc),約束を守ることは大切です。,Giữ lời hứa là rất quan trọng.,ルールを守って遊びましょう。,Hãy chơi theo quy tắc.,https://www.tanoshiijapanese.com/dictionary/entry_preview/5/31320/42616.png
式が始まります,bắt đầu (lễ),結婚式が午後2時に始まります。,Lễ cưới sẽ bắt đầu lúc 2 giờ chiều.,式が始まる前に、みんなが集まります。,"Trước khi lễ bắt đầu, mọi người sẽ tập trung lại.",https://www.keiwa-c.ac.jp/wp2021/wp-content/uploads/2023/03/8f32085fee7449f3006700ff6cdb5667-scaled.jpg
会議に出席します,tham dự (họp）,明日の会議に出席しますか？,Bạn có tham dự cuộc họp ngày mai không?,彼は会議に出席するために早く来ました。,Anh ấy đến sớm để tham dự cuộc họp.,https://previews.123rf.com/images/torkk/torkk1608/torkk160800135/62620837-%E3%82%AA%E3%83%95%E3%82%A3%E3%82%B9%E3%81%A7%E4%BC%9A%E8%AD%B0%E3%81%AB%E5%87%BA%E5%B8%AD%E3%80%82%E3%83%99%E3%82%AF%E3%83%88%E3%83%AB.jpg
伝えます,nói lại,彼にメッセージを伝えます。,Tôi sẽ nói lại tin nhắn cho anh ấy.,この情報をみんなに伝えます。,Tôi sẽ nói lại thông tin này cho mọi người.,https://www.tanoshiijapanese.com/dictionary/entry_preview/5/42546/55635.png
車に注意します,chú ý (xe ô tô),道を渡るときは車に注意してください。,"Khi băng qua đường, hãy chú ý đến xe ô tô.",運転中は常に車に注意します。,"Trong khi lái xe, tôi luôn chú ý đến xe ô tô.",https://www.city.sumida.lg.jp/kosodate_kyouiku/kosodate_site/kosodate_qa/syugakutyokuzenki/anzenishiki.images/S36.jpg
席を外します,rời (ghế),少しの間、席を外します。,Tôi sẽ rời ghế một chút.,会議中に席を外すことはできません。,"Trong cuộc họp, không thể rời ghế.",https://nihongopic.com/wp-content/uploads/2019/08/3f07693addf0e4239095043d880c1977.png
戻ります,trở lại,すぐに戻りますので、待っていてください。,"Tôi sẽ trở lại ngay, hãy chờ một chút.",彼は仕事が終わったら戻ります。,Anh ấy sẽ trở lại sau khi công việc kết thúc.,https://honki.vn/storage/lesson/basic2/v4/lesson_30/picture/modorimasu.jpg
電話があります,có điện thoại,あなたに電話がありますよ。,Có điện thoại cho bạn.,会議中に電話があります。,Có điện thoại trong cuộc họp.,https://www.ymobile.jp/sp/guide/article32/1.jpg
リサイクルします,tái chế,私たちはプラスチックをリサイクルします。,Chúng tôi tái chế nhựa.,リサイクルすることで環境を守ります。,"Bằng cách tái chế, chúng ta bảo vệ môi trường.",https://previews.123rf.com/images/yupiramos/yupiramos1706/yupiramos170625420/80759501-%E7%9F%A2%E5%8D%B0%E3%82%B7%E3%83%B3%E3%83%9C%E3%83%AB-%E3%82%A2%E3%82%A4%E3%82%B3%E3%83%B3-%E3%83%99%E3%82%AF%E3%83%88%E3%83%AB-%E3%82%A4%E3%83%A9%E3%82%B9%E3%83%88-%E3%83%87%E3%82%B6%E3%82%A4%E3%83%B3%E3%82%92%E3%83%AA%E3%82%B5%E3%82%A4%E3%82%AF%E3%83%AB%E3%81%97%E3%81%BE%E3%81%99%E3%80%82.jpg
だめ（な）,không được,ここで喫煙するのはだめです。,Hút thuốc ở đây là không được.,遅刻するのはだめです。,Đến muộn là không được.,https://tblg.k-img.com/resize/640x360c/restaurant/images/Rvw/247755/f2c0f1fd8af8fc6fdf7d25231b3bfeef.jpg?token=79338a8&api=v2
同じ,giống,私たちは同じ趣味を持っています。,Chúng tôi có sở thích giống nhau.,この二つの絵は同じです。,Hai bức tranh này là giống nhau.,https://i.ytimg.com/vi/8oCovnYXFrY/hq720.jpg?sqp=-oaymwEhCK4FEIIDSFryq4qpAxMIARUAAAAAGAElAADIQj0AgKJD&rs=AOn4CLD-edcCuq_j46unmZvO23ND6PIxKA
警察,đồn cảnh sát,警察に行って、事件を報告しました。,Tôi đã đến đồn cảnh sát để báo cáo vụ việc.,近くの警察署は、24時間営業しています。,Đồn cảnh sát gần đây mở cửa 24 giờ.,https://cityoflakewood.us/wp-content/uploads/2023/09/DSC08053-scaled.jpg
